Company,# of posting,Skill
Micron Technology Operations India LLP,47,"High Availability, Software Development, Shell Scripting...#####SAP ECC, Administration Management, Solution Delivery, Customer Focus, Data...#####Customer Service, Desktop Support, Computer Hardware, System Administration...#####replication, high availability, python, sql queries, information technology...#####data analysis, information technology, development testing...#####High Availability, Software Development, Shell Scripting...#####SAP ECC, Administration Management, Solution Delivery, Customer Focus, Data...#####Customer Service, Desktop Support, Computer Hardware, System Administration...#####replication, high availability, python, sql queries, information technology...#####data analysis, information technology, development testing...#####Database Maintenance, High Availability, Shell Scripting, Web Technologies,...#####Application Programming, Software Development, Web Technologies...#####High Availability, Database Administration, SSRS, MS SQL Server...#####Service Improvement, User Support, Customer Support, Networking...#####SAP ECC, Service Level, Sap Portal, Disaster Recovery, NetWeaver, Sap Hana,...#####Troubleshooting Skills, Customer Service, Desktop Support...#####Development Testing, Design Development, Computer Science, Business Process...#####risk management, IT Risk Management, Cisa, Audit Compliance...#####operations, information technology, problem analysis, quality standards...#####TCP, Audio Visual, Architecture, IP, Computer Science, LAN, OSI Model...#####CSS, Azure, Software Development, NoSQL, Javascript, .Net, HTML...#####Technology Operations, Enterprise Architecture, PowerShell DSC, RPA, System...#####Business Intelligence, Financial Analysis, Accounting, Business Finance...#####SAP ChaRM, SAP Transprt Management System, Application Administration...#####test management, K2, test cases, business rules, system support, powerbi...#####Regression Testing, Defect Management, Test Planning, Automation Testing...#####MVC Framework, MySQL, Javascript, Bootstrap, JSON, HTML, Node.Js, JQuery...#####IT Asset Management, Software Licensing, maintenance...#####Technology Management, Service Level, Customer Service, Project Management,...#####SS, Business Intelligence, Microsoft BI tool stack, SSAS...#####C#, CSS, Front End, NoSQL, Software Engineering, Web Technologies...#####MDX, Integration Services, Reporting Services, SSAS, Analysis Services...#####sql development, ssas, ms sql server, qlik, business intelligence, plsql...#####SQLT, Data Guard, Performance Tuning, TKPROF, TFA, RMAN, SQL design, OLTP /...#####sql development, ssas, ms sql server, qlik, business intelligence, plsql...#####SQLT, Data Guard, Performance Tuning, TKPROF, TFA, RMAN, SQL design, OLTP /...#####Integration Services, Reporting Services, SSAS, Analysis Services, Business...#####Data Management Analyst, Quality Monitoring, Data Quality, Excel Powerpoint...#####Data Science, Business Intelligence, Supply Chain Planning, Bi, OLAP...#####C#, CSS, Front End, NoSQL, Software Engineering, Web Technologies...#####TCP, IP Telephony, Networking, Computer Science, DNS, Load Balancing, SIP...#####technical support, field support, service desk, active directory...#####release management, project management, Automation, product support...#####Microsoft Exchange, MS Exchange, MS Active Directory, Disaster Recovery...#####Test Engineering, Testing Tools, Regression Testing, Retesting...#####C#, operational support, system integration, software development...#####quality analysis, Change Management, data quality, Lean, data management..."
Mindblu Technologies Pvt Ltd,3,"Computer science, Illustrator, Analytical, Javascript, HTML, Visio...#####PLM, System architecture, XML, Javascript, JSON, MVC...#####Computer science, Electrical engineering, NoSQL, RDBMS, Coding, Javascript,..."
Mitratech,1,"Linux Administration, Java, Websphere Application Server, Automation, SAP..."
Mount Talent Consulting Private Limited,1,"C#, CSS, Kendo Ui, HTML, SQL Server, WPF, .NET Framework, Angular..."
NEER INTERACTIVE SOLUTIONS (P) Ltd,4,"erp, it services, information technology, dealing, documentation, english...#####erp, it services, information technology, dealing, documentation, english...#####erp, it services, information technology, dealing, documentation, english...#####erp, client managementcumentationales process, development..."
NEILMED DEVICES PVT LTD,1,"C#, Java, suitescript, suiteflow, CSS, VB.NET, Github, suitetalk, HTML..."
NISG (National Institute for Smart Government),7,"PHP Developer, HTML5, Javascript, PHP, JSON, CSS3#####Java, Hibernate, Core Java, HTML5, JavaScript, Programming, JSON, J2ee...#####PHP Developer, HTML5, Javascript, PHP, JSON, CSS3#####Hibernate, Core Java, HTML5, JavaScript, JSON, J2EE, CoreJava, CSS3#####Network Configuration, Networking, Network Security, Network Maintenance...#####SAN, Open Source, ISCSI, Remote Support, Disaster Recovery, NFS...#####Database Administration Postgre, DBA Postgre"
NTT Global Delivery Services Limited,1,"IT services, Automation, development, sap, technical, Schema..."
Nagarjuna Fertilizers and Chemicals Limited.,1,"PMP, Project Management, Scope Management, Scheduling..."
Napier HealthCare,2,"Business Analyst, Business analysis, Analytical, Workflow, CMMI, Healthcare...#####Computer science, Product launch, Publishing, Project management, Workflow,..."
National Recruiting Firm US Based,1,"it recruitment, recruiter, Technical Recruitment"
Naukri Premium - Employer Services,3,"Team Management, Team Handling, Business Process Management, IT Risk, ITGC,...#####IT Audit, Data Integrity, Technology Audit, IT Risk, Compliance, Accounting...#####css, java, angular js, html5 html 5, j2ee, html, javascript"
NebuLogic Technologies,12,"development, Business Analyst, technical, configuration, methods, testing...#####Cloud computing, server, ERP, Automation, technical, Project management...#####development, information technology, technical, configuration, methods...#####development, Business Analyst, technical, configuration, methods, testing...#####Cloud computing, server, ERP, Automation, technical, Project management...#####development, information technology, technical, configuration, methods...#####Cloud computing, ERP, Automation, Business Analyst, Project management...#####development, information technology, computer science, documentation...#####development, erp, project management, technical support, automation...#####Computer science, Analytical skills, Core Java, Java web services...#####server, ERP, technical, Project management, Technical support, sql, cloud...#####development, erp, project management, automation, operations, port..."
Needa Software Solutions Pvt Ltd,1,"C#, Angularjs, IIS, OOPS, MS SQL Server, Entity Framework, ASP.Net MVC..."
Neer Kamal Job Consultancy,1,"Java, Software Development, it development, hardware programming..."
NetScore Technologies Pvt. Ltd.,1,"project scheduling, netsuite implementation, netsuite, salesforce..."
Netrovert Software Private Limited,1,"SOA, technical, it, Middleware, Information technology..."
Neustar MarketShare,1,"Technical product configuration, c++, C, design, MySQL, JavaScript..."
"Neustar, Inc",1,"Computer science, Tools, Data processing, Business intelligence..."
Newt Global India Private Limited,1,"Jboss Application Server, Rest, Core Java, Web Technologies, Spring Boot..."
Novartis Healthcare Pvt. Ltd.,82,"Unix, Aix, Performance tuning, Linux, Database administration, Healthcare...#####IT services, Service delivery, remediation, Information security, SOC...#####Prototype, User interface designing, project support, Illustrator...#####operational support, development testing, Architecture, Compliance, Legal...#####Unix, Performance tuning, C++, Linux, Enterprise applications, Healthcare...#####Change management, People development, IT strategy, Pharma, Life sciences...#####Computer science, Time management, Web development, Javascript, Application...#####Service management, Solution architecture, Relationship management...#####Computer science, People development, IT strategy, Pharma, Life sciences...#####Service delivery, ERP, SAP, Development Expert, Technical design, Legal...#####Unix, Aix, Performance tuning, Linux, Database administration, Healthcare...#####IT services, Service delivery, remediation, Information security, SOC...#####Prototype, User interface designing, project support, Illustrator...#####operational support, development testing, Architecture, Compliance, Legal...#####Unix, Performance tuning, C++, Linux, Enterprise applications, Healthcare...#####Change management, People development, IT strategy, Pharma, Life sciences...#####Computer science, Time management, Web development, Javascript, Application...#####Service management, Solution architecture, Relationship management...#####Computer science, People development, IT strategy, Pharma, Life sciences...#####Service delivery, ERP, SAP, Development Expert, Technical design, Legal...#####System architecture, advanced analytics, Architecture, Business analytics...#####IT services, Automation, Content management, Information security...#####GIS, Service management, Application support, French, Access management...#####Service delivery, Unix, IT services, Computer science, SAN, Healthcare...#####Automation, Technical management, Information security...#####Business process, PMP, Data conversion, Enterprise architecture...#####IT services, Automation, Information security, Configuration management...#####Computer science, Solution architecture, Service delivery, Architecture...#####Performance tuning, Networking, Data management, HP data protector...#####IT services, Business services, Change management, Business Analyst...#####IT services, Computer science, Lead Operations, Problem management...#####IT services, Change management, Project estimation, Business Analyst...#####IT services, Change management, Business Analyst, Process documentation...#####Computer science, Solution architecture, Data management, Architecture...#####Service management, advanced analytics, Data management, Problem management...#####Solution architecture, Application integration, Architecture, Coding...#####IT services, Problem management, Customer service, Business continuity...#####Solution architecture, Service delivery, Compliance, Technical design...#####Service delivery, IT services, Computer science, SOA, Pharma, Healthcare...#####IT services, Business services, Change management, Business Analyst...#####Service delivery, IT services, PMP, Consulting, Healthcare...#####Computer science, Solution architecture, System architecture...#####Service delivery, IT services, Business services, IT strategy, Pharma...#####Unix, Data management, Access management, big data, Business continuity...#####IT services, Computer science, Service management, WAN, Problem management,...#####Computer science, Business process, Application support, Change management,...#####System architecture, Business analysis, Management systems...#####IT services, PMP, Pharma, Consulting, Healthcare, Business strategy...#####Computer science, Solution architecture, System architecture, Automation...#####Computer science, Technical Architect, Matrix, Coding, Architectural design...#####GIS, Computer science, Operations Manager, AS400, Control-M, Healthcare...#####Change management, Compliance, Pharma, Pharmacy, GLP, data integrity...#####Unix, System architecture, advanced analytics, Solution design...#####Business process, Business services, Service delivery...#####Procurement, Business services, Change management, PMP, IT strategy...#####Computer science, Performance management, IT strategy, Healthcare...#####IT services, Business services, operational support, Service level...#####Procurement, Computer science, Service management, Networking, IVR, CCNA...#####IT services, Change management, Content management, Project management...#####Business services, ERP, Service level, Consulting, ITSM, Healthcare...#####IT services, Service management, Problem management, Healthcare...#####security architect, ERP, Change management, Cisa, Coding, Consulting...#####Computer science, Business services, Pharma, Healthcare, Life sciences...#####IT services, Computer science, Change management, Problem management...#####Solution design, Business consulting, Quality standards, SAP, Architecture,...#####Computer science, Service management, Solution architecture, PMP...#####Computer science, operational support, Version control, orchestration...#####Business services, Problem management, Healthcare, Customer service...#####Computer science, Solution architecture, metadata, Data management, PLSQL...#####Computer science, Data management, Enterprise applications...#####Computer science, Solution architecture, Data management, Architecture...#####Computer science, Solution architecture, Automation, GIT, PAAS...#####operational support, development testing, Architecture, Compliance...#####IT services, Computer science, Problem management, Incident management...#####Computer science, Solution architecture, Automation, PAAS, Machine learning...#####Business process, Business services, Service delivery...#####Computer science, RSS, DTD, XML, Consulting, Oracle, Information technology...#####Computer science, Business services, Content management, Architecture...#####Solution architecture, Relationship management, Business services, Solution...#####Crisis management, Data management, Access management, Problem management...#####Service management, Relationship management, Architecture, Technical design...#####Interaction design, Legal, Agile, User experience design..."
Nowcom Global Services India Pvt Ltd,1,"css, asp.net mvc, entity framework, ado.net, html, Front End Developer..."
OSI DIGITAL PRIVATE LIMITED,1,"c#, mvc framework, asp.net mvc, reporting services, oops, sql server..."
OSI Systems Pvt. Ltd.,1,"iso 27001, trend micro, it security, security analysis, qradar, soc..."
Okda Solutions,1,"java, data science, .net, software engineering, machine learning..."
OpsMx,1,"English, Written Communication, Communications, Technical Writer..."
OpsRamp,3,"Computer science, Networking, Linux, Technical writing, MySQL, microsoft...#####Computer science, Networking, Linux, Technical writing, MySQL, microsoft...#####Computer science, Email, Linux, Helpdesk, Cisco, Windows, microsoft..."
"Optum, a UnitedHealth Group Company",5,"TS Multiple Locations, Architect - Hyderabad#####Cloud - Hyderabad, Technical Lead Java, TS#####Senior Technical Support Analyst - Hyderabad Multiple Locations#####Associate Director - Medical Coding - Hyderabad, TS#####Software Engineering Analyst - Java Fullstack - Multiple Locations"
Oravel Stays Private Limited,1,"TCP, Networking, Network Engineer, VPN, Routing, L3VPN, Bgp, CCNA, MPLS..."
Oruganti Consultants,1,"Unix, Java, Project Management, Design Patterns, UML, OOAD, OOPS..."
Pamten Software Solutions Pvt. Ltd.,4,"Computer science, Business process, System testing, PMP, Project management...#####PMP, Email, Doc, Risk, General management, Information technology, closure,...#####Business process, Process design, Computer science, PMP, PDF...#####Process design, PMP, Business Analyst, User interface designing..."
Pathfinder Management Consulting (India) Ltd.,3,"C#, Powershell, System Analysis, Microsoft Azure, .Net, Problem Management,...#####Big Data, Bigdata#####Database Administration, SQL Azure, hadr solution, azure"
Pentagon Consultancy Services,1,"Tomcat, Linux, Solaris, JBoss, Shell scripting, PLSQL..."
People Value Consulting,1,"Construction Operations, Program Management, Project Management"
Personal Network. Ltd,2,"Senior Design Engineer, PROC, Technology consulting, Networking, RDBMS...#####Technical product configuration, c++, C, design, MySQL, JavaScript..."
Planon,2,"server, development, Performance management, software, Web development...#####server, Tomcat, development, software, JBoss, Web development, HTML..."
Process360 Pvt Ltd,1,"business ops manager, information technology, business ops executive..."
Progress Software Development Pvt Ltd,1,"Aix, VMware, SAN, C++, Automation, Linux, Solaris, Configuration management..."
Proxim Quest It Solutions Private Limited,1,"server, Content management, development, Filenet, analytical..."
Purple Cow IT Services,1,"Sales Analysis, Product Analysis, Customer Satisfaction, Digital Marketing,..."
Pyramid IT Consulting Pvt Ltd.,1,"head hunting, talent acquisition, us it recruitment, screening, recruitment..."
QUANTIUM ANALYTICS PRIVATE LIMITED,2,"xaml, c#, GIT, CI / CD Pipeline, automation engineering, .net, wpf...#####Team Management, Angularjs, Product Management, people management..."
Quadruple Automation Services Pvt Ltd,2,"Socket programming, Automation, software, JBoss, mobile, mca, jdbc, it...#####Socket programming, Automation, software, JBoss, mobile, mca, jdbc, it..."
Quality Systems India Healthcare Pvt Ltd,8,"css, code, technical, software, configuration, HTML, sql, java, web, design...#####development, code, software, Postgresql, Information technology, quality...#####C, code, technical, software, JSON, microsoft, sql, Coding, web, design...#####code, technical, software, microsoft, sql, Coding, web, design, debugging...#####Administration, Interpersonal skills, Claims, Senior Executive...#####code, technical, software, configuration, developing, HTML, sql, java, web,...#####Front end, SOA, Data modeling, MySQL, Flex, Healthcare, Unit testing...#####Core Java, Manager Quality Assurance, Configuration management, Agile, JDBC..."
Quality Thought Infosystems (India) Private Limited,1,"Training, Media strategy, Social media, Banking, digital marketing trainee,..."
Quantega,7,"Computer science, Telecom, Administration, Interpersonal skills, WAN...#####management, Intellectual property, Strategic planning...#####Unix, JMS, Linux, RDBMS, Oracle, EJB, Open source, Middleware...#####Computer science, Networking, IT strategy, query, Infrastructure...#####management information system, Staffing, Organizational development...#####Procurement, Computer science, Technical management, Network administration...#####Front end, Disaster recovery, DBMS, Management, Troubleshooting..."
RISE Pvt. Ltd.,2,"IT services, LDAP, VPN, XML, Configuration management, Consulting...#####IT services, LDAP, VPN, XML, Configuration management, Consulting..."
Ram IT Solutions,1,"IT services, Service management, Performance management..."
Ray Business Technologies,2,"AX functional, Retail, Configuration, POS, Dynamics AX 2012#####AX functional, Retail, Configuration, POS, Dynamics AX Retail..."
Raytex IT Services.,1,"Unix, Administration Manager, Networking, WAN, LAN, Active directory, DNS..."
Rechlinks Private Limited,1,"Java, CSS, Android Developer, Amazon Ec2, Github, Html5..."
Recruise India Consulting Pvt. Ltd.,1,"Communication Skills, Design Development, Written Communication, Networking..."
Riconz Technologies,3,"Technical Architect, Java, Azure, Cloud, .Net, Cloud Migration, ASP.NET MVC...#####Technical Architect, Java, Azure, Cloud, .Net, Cloud Migration, ASP.NET MVC...#####C#, Cloud Platform AWS, Web API or WCF, Azure, VB.NET, SQL Server..."
Roopa Soft LLP,4,"Computer science, Training, System testing, Analytical, Test Associate...#####Computer science, Training, System testing, Analytical, Software Associate,...#####be, analytical, net technologies, academic...#####quantitative skills, be, analytical, software, net technologies, academic..."
Rope Media Pvt. Ltd.,3,"continuous integration, Spring mvc, Web services, Payment systems...#####MVVM, Agile development, Swift, ios development, Information technology#####Hibernate, Core Java, Web services, Analytical, Agile development..."
Rroot Shell Technologies Private Limited,3,"Java, Business Consulting, Management Consulting, SDET, Automation Testing,...#####Exadata, Database Administration, RAC, SQL Tuning, Backup Management...#####SAP BO, Management Services, Performance Optimization..."
Ryan India Tax Services Pvt. Ltd.(Great Place to Work Certified),1,"Database Administration, dba, Powershell, SSRS, SAS 70, SQL Server, Telerik..."
S&P Global Inc.,2,"Data analysis, metadata, analytical, functions, Database design, level...#####Data analysis, metadata, analytical, functions, Database design, level..."
S-Square Data Systems Private Limited,4,"Unix, R12, Cloning, Weblogic, Oracle Apps Dba, PLSQL, Patching, Demantra...#####Dataguard, Exadata, Oracle SQL, RAC, Cloning, Oracle DBA, Patching...#####Unix, TIBCO Administrator, TIBCO BW, Oracle Fusion Middleware, XML...#####Unix, Control - M, Linux, Oracle Database, Cognos, PLSQL, Informatica..."
S2TECH.COM INDIA PVT LTD,2,"Design, information technology engineering, Coding, Software Engineering...#####Design, information technology engineering, Coding, Software Engineering..."
SAP Labs India Pvt. Ltd.,1,"oracle pl, sql queries, java, customer service, Informatica, etl, unix..."
SENECAGLOBAL IT SERVICES PRIVATE LIMITED,1,"senior ui developer, redux, ui developer, css, ui development, js, react..."
"SILICON TECH SOLUTIONS, INC",1,"Badis, MM, Data Dictionary, GTS, Function Modules, Alv, RFC, SD, SAP ABAP..."
SKS Enterpprises,1,"c#, continuous integration, c++, c, appium, automation testing..."
SONATA SOFTWARE LIMITED,1,"Networking, SOA, VPN, Billing, DNS, Application development, Visual Studio,..."
SRS Business Solutions,4,"C#, Angularjs, Microsoft Dynamics CRM certifications, MS Dynamics CRM...#####Microsoft Developer, Microsoft Dynamics CRM certifications...#####Microsoft Developer, Microsoft Dynamics CRM certifications...#####Microsoft Developer, Microsoft Dynamics CRM certifications..."
SRS Business Solutions India Pvt. Ltd.,1,"C#, Angularjs, MS Dynamics CRM, C#.Net, Javascript, Entity Framework..."
SYMPHONI HR,1,"Network Engineering, Networking, GM, Hardware, Network Administration..."
Sahasya Global Solutions,4,"VMware, server, Networking, technical, Technical writing, administration...#####technical, software, System programming, testing, it, Troubleshooting...#####Computer science, Automation, Db2, Postgresql, MySQL, Debugging...#####code, technical, software, Schema, developing, tools, cloud, database, java..."
Sai Sectretarial Services,1,"Computer science, Hibernate, MS SQL, jQuery, UML, Javascript, Life sciences..."
Sathguru Management Consultants Pvt Ltd,1,"Social media marketing, Printing, Public relations, Web analytics..."
Sathguru Management Consultants Pvt Ltd.,1,"external communication, media relations, newsletters..."
Secureworks,3,"Analytical skills, tableau, Excel, SSAS, data governance, EMC, Informatica,...#####Unix, MS SQL, Coding, Debugging, EMC, Scrum, Informatica, Teradata...#####Unix, MS SQL, Coding, Debugging, EMC, Scrum, Informatica, Teradata..."
SenSen Video Business Intelligence Private Limite d,2,"Sales Engineering, Demo, POC#####Sales Engineering, Demo, POC"
Shuchita Technologies (P) Ltd.,1,"Computer science, Sql Server 2008, server, jQuery, .NET framework, .Net, HR..."
Siemens Limited,1,"metadata, Web services, Cloud Applications, SFDC, Salesforce.com..."
Skill On Tap,1,"Java, Webservices Testing, Automation Testing Tools, API Testing..."
Skillsoft,2,"Computer science, Tomcat, IIS, SOA, Coding, Technical writing, MySQL...#####Unix, Automation, Linux, Networking, Technical writing, Javascript, Perl..."
Smart IMS (India) Pvt. Ltd,1,"Cold calling, Managed servicesMPLS, Networking, Diagnostics, Appliances..."
Solugenix India Private Limited,1,"splunk, Dashboards, unix"
Spectraforce Technologies (India) Pvt. Ltd.,5,"us it recruiter, us it recruitment...#####us it recruiter, us it recruitment...#####us it recruiter, us it recruitment...#####us it recruiter, us it recruitment...#####us it recruiter, us it recruitment..."
Spectrum,3,"SAP ECC, cloud integration, Application Lead, supply planning...#####mapping, test management, content activation, solman, trex, sld, rslaf, occ...#####d365, senior management, project management, erp, project development..."
Spot In Job Consultancy,13,"PSD, Illustrator, Javascript, HTML, Scheduling, SEO, Photoshop, Information...#####Web development, Debugging, CMS, PHP, HTML, Troubleshooting, Ruby...#####Software design, Visual Basic, Javascript, MVC, Troubleshooting...#####HR Administrator, Staffing, Web development, Consultancy...#####Graphics, Graphic designing, PDF, Illustrator, Staffing, Corel Draw...#####Front end, Web development, Debugging, CMS, PHP, Troubleshooting, Ruby...#####PDF, Staffing, MySQL, SMS, PHP, HTML, Scheduling, Information technology...#####Version control, Coding, Staffing, Javascript, HTML, Scheduling...#####Drupal, MySQL, Javascript, PHP, HTML, Scheduling, Stored procedures...#####HR Administrator, PDF, Staffing, Wordpress, Manager Technology, PHP...#####Graphics, PDF, Staffing, Animation, Consultancy, Scheduling...#####Backend, Usage, PDF, MIN, Programming, Manager Technology, PHP, Consultancy...#####Drupal, XML, Wordpress, Javascript, PHP, HTML, JSON, Open source, Joomla..."
Spruce IT Pvt. Ltd.,1,"screening, recruitment, Bench Sales Recruiter, h1b..."
Srinsoft Technologies Pvt. Ltd.,1,"pega prpc, software development, pega developer, pega rules commander, pega..."
Stalwart Management Consulting,1,"Team leading, SAS, Pharma, Management consulting, Life sciences..."
Sunera Technologies.,2,"Performance tuning, code, technical, analytical, software, administration...#####Performance tuning, code, technical, analytical, software, administration..."
